<?xml version="1.0" encoding="UTF-8"?>
<?xml-stylesheet type="text/xsl" href="projets.xsl"?>
<projets xmlns:xsi="http://www.w3.org/2001/XMLSchema-instance" xsi:noNamespaceSchemaLocation="projets.xsd">
  <projet id="1">
    <titre>Test</titre>
    <idBranche>2</idBranche>
    <synopsis>Super résumé</synopsis>
    <ajouteLe>05/06/2009</ajouteLe>
    <responsables>
      <responsable>greg</responsable>
    </responsables>
    <auteurs>
      <auteur>super</auteur>
    </auteurs>
    <motsCle>
      <motCle>albert</motCle>
    </motsCle>
    <nomArchive>TODO.rtf</nomArchive>
  </projet>
  <projet id="2">
    <titre>That\'s the way</titre>
    <idBranche>2</idBranche>
    <synopsis>fdsafads</synopsis>
    <ajouteLe>05/06/2009</ajouteLe>
    <responsables>
      <responsable>Super</responsable>
    </responsables>
    <auteurs>
      <auteur>Cool</auteur>
    </auteurs>
    <motsCle>
      <motCle>Francis</motCle>
    </motsCle>
    <nomArchive>GestionProjet.php</nomArchive>
  </projet>
</projets>
