<?xml version="1.0" encoding="ISO-8859-1"?>
<?xml-stylesheet type="text/xsl" href="projets.xsl"?>
<projets xmlns:xsi="http://www.w3.org/2001/XMLSchema-instance" xsi:noNamespaceSchemaLocation="projets.xsd">
  <projet id="1">
    <titre>Project Archiver</titre>
    <idBranche>3</idBranche>
    <synopsis>Ce projet permet d\'archiver les projets réalisés à la HEIG-VD.</synopsis>
    <ajouteLe>02/06/2009</ajouteLe>
    <responsables>
      <responsable>Eric Lefrançois</responsable>
    </responsables>
    <auteurs>
      <auteur>Grégory Brissonnette</auteur>
      <auteur>Thomas Jordan</auteur>
      <auteur>Grégory Moinat</auteur>
    </auteurs>
    <motsCle>
      <motCle>XML</motCle>
      <motCle>GWT</motCle>
      <motCle>XPATH</motCle>
      <motCle>XSLT</motCle>
    </motsCle>
    <nomArchive>Project Archiver Rapport.rtf</nomArchive>
  </projet>
  <projet id="2">
    <titre>Poulailler</titre>
    <idBranche>1</idBranche>
    <synopsis>Ce projet simule un poulailler</synopsis>
    <ajouteLe>02/06/2009</ajouteLe>
    <responsables>
      <responsable>Eric Lefrançois</responsable>
    </responsables>
    <auteurs>
      <auteur>Raphaël Tripet</auteur>
      <auteur> Grégory Moinat</auteur>
    </auteurs>
    <motsCle>
      <motCle>WEB</motCle>
      <motCle> Ruby on rails</motCle>
      <motCle> Poules</motCle>
      <motCle> Paysan</motCle>
      <motCle>MySQL</motCle>
    </motsCle>
    <nomArchive>Titre.jpg</nomArchive>
  </projet>
</projets>
